{
  "$schema": "https://luibui.com/spec/luibui.schema.json",
  "schema_version": "1",
  "name": "beispiel/wetter-skill",
  "version": "1.0.0",
  "typ": "skill",
  "beschreibung": "Zeigt die Wettervorhersage für einen Ort.",
  "lizenz": "MIT",
  "einstieg": "SKILL.md",
  "rechte": {
    "netzwerk": true,
    "dateien": { "lesen": [], "schreiben": [] },
    "shell": false,
    "zugangsdaten": false,
    "umgebungsvariablen": []
  },
  "endpunkte": [
    {
      "host": "api.wetter.example",
      "zweck": "Vorhersage abrufen",
      "land": "DE",
      "datenkategorien": ["nutzereingaben", "standortdaten"],
      "rechtsgrundlage": "keine_uebermittlung"
    }
  ],
  "datenkategorien": ["nutzereingaben", "standortdaten"],
  "speicherung": { "lokal": false, "dauer": "keine" }
}
